title,mechanical_style,product_type,genre,players,time,complexity,gm_structure,campaign_type,hook,if_you_like,bg_icon,components,link,to_play,to_run,digital_buy,digital_print,physical_buy,collections,verified_fields
Honey Heist,Story Game,TTRPG,Drama|Gonzo,3 to 6,60,Easy,Facilitated,One-Shot,Criminal bears pulling off a honey heist,Party games and chaos,delapouite/bear-head,D6 only,https://example.com/honey-heist,Played,,Bought,,,Indie|One-Page,title|mechanical_style
Blades in the Dark,OSR,TTRPG,Dark|Fantasy,3 to 5,180,Hard,GM-led,Long,Scoundrels in a haunted city,Peaky Blinders and heist stories,,Polyhedral dice|Character sheets,https://example.com/blades,,ToRun,Bought,ToPrint,,Narrative|Heist,
Lasers & Feelings,Story Game,TTRPG,Sci-Fi,3 to 6,90,Easy,Facilitated,One-Shot,Star Trek meets improv comedy,Star Trek and quick sessions,,No components,https://example.com/lasers,Played,,,,,Indie|One-Page,title
Mothership,OSR,TTRPG,Sci-Fi|Dark,3 to 6,120,Medium,GM-led,Short,Survival horror in space,Alien and Dead Space,,Polyhedral dice|Character sheets|Custom cards,,,,,,Horror|Sci-Fi,
Quest,Traditional,TTRPG,Fantasy|Cozy,2 to 6,120,Easy,GM-led,Short|Long,A welcoming fantasy RPG for all ages,Approachable fantasy adventures,,Rules booklet|Polyhedral dice,https://example.com/quest,Played,,Bought,,,Family|Fantasy,title|genre
